{
  "paths": {
    "resumeDir": "~/workspace/resume"
  },
  "metadata": {
    "version": "1.2.0",
    "lastUpdated": "2026-07-29",
    "notes": "Added paths config for agent tooling"
  },
  "personalInfo": {
    "name": "Ryan Maloney",
    "email": "rsmaloney@gmail.com",
    "phone": "(574) 612-5413",
    "linkedin": "https://www.linkedin.com/in/rsmaloney/",
    "github": "https://github.com/rmaloneycvg",
    "portfolio": "",
    "location": "Broomfield, CO"
  },
  "summaryTemplates": [
    {
      "focus": "full-stack",
      "text": "Full Stack Engineer with {yearsExperience}+ years delivering scalable web applications across React, .NET, Node.js, and Python. Proven track record architecting microservices, serverless APIs, and data pipelines on AWS, Azure, and GCP. Combines deep technical execution with pragmatic leadership\u2014mentoring teams, championing observability, and shipping iteratively under tight constraints."
    },
    {
      "focus": "frontend",
      "text": "Frontend-focused Full Stack Engineer with {yearsExperience}+ years building performant, accessible interfaces in React, Angular, Vue.js, and TypeScript. Experienced with GraphQL/Apollo, component-driven architectures, and comprehensive E2E testing with Playwright. Passionate about developer experience, design systems, and delivering polished UIs that drive measurable business outcomes."
    },
    {
      "focus": "backend",
      "text": "Backend and platform engineer with {yearsExperience}+ years designing distributed systems, ETL pipelines, and serverless architectures on AWS and Azure. Deep expertise in .NET, Node.js, Python, and SQL with proven ability to migrate legacy systems, establish observability practices, and maintain <5-minute downtime SLAs for mission-critical deployments."
    },
    {
      "focus": "leadership",
      "text": "Technical Lead and Senior Engineer with {yearsExperience}+ years shipping production software while growing engineering teams. Champions iterative delivery, integration-first testing, and AI-augmented development workflows. Leads with empathy in code reviews and technical debates, ensuring teams ship confidently under tight constraints. Primary metric for success: the success of those mentored."
    }
  ],
  "skills": {
    "categories": [
      {
        "name": "Languages",
        "skills": [
          "TypeScript",
          "JavaScript",
          "Python",
          "C#",
          "SQL",
          "HTML/CSS"
        ]
      },
      {
        "name": "Frameworks & Libraries",
        "skills": [
          "React",
          ".NET",
          "Node.js",
          "Angular",
          "GraphQL",
          "Apollo",
          "TanStack Query",
          "React Redux",
          "Express.js",
          "Entity Framework",
          "Celery",
          "Tailwind CSS",
          "Bootstrap",
          "AG Grid",
          "Apryse",
          "jQuery"
        ]
      },
      {
        "name": "Cloud & Infrastructure",
        "skills": [
          "AWS",
          "Azure",
          "GCP",
          "Serverless Architecture",
          "Docker",
          "Tilt",
          "Databricks",
          "SQL Server",
          "PostgreSQL",
          "Firebase",
          "MySQL",
          "Redis",
          "MongoDB",
          "Nebula GraphDB",
          "RabbitMQ"
        ]
      },
      {
        "name": "Architecture",
        "skills": [
          "Microservices",
          "Serverless",
          "Event-Driven Architecture",
          "REST APIs",
          "SOAP",
          "Socket.IO",
          "ETL Pipelines",
          "Distributed Tracing",
          "API Gateway",
          "OAuth2/Entra ID"
        ]
      },
      {
        "name": "Tools & Practices",
        "skills": [
          "GitHub Actions",
          "CI/CD Pipelines",
          "SSRS (SQL Server Reporting Services)",
          "Grafana",
          "Prometheus",
          "Jaeger",
          "OpenTelemetry",
          "CloudWatch",
          "Application Insights",
          "Playwright",
          "Vitest",
          "Jest",
          "xUnit",
          "NUnit",
          "pytest",
          "JMeter",
          "OpenAI",
          "LangChain",
          "LangGraph",
          "Llama",
          "IBM Watson AI SDK",
          "NVIDIA SDK",
          "MCP Services"
        ]
      }
    ]
  },
  "experience": [
    {
      "company": "Pellera",
      "title": "Tech Lead / Sr. Software Engineer",
      "startDate": "September 2022",
      "endDate": "May 2026",
      "location": "Remote",
      "remote": true,
      "bullets": [
        {
          "text": "Co-developed an AI application using Python, Node.js, IBM Watson AI, and NVIDIA libraries featuring conversation summarization, key term extraction, speaker diarization, and a next-best-action agent driven by entity extraction and vectorized Nebula GraphDB",
          "keywords": [
            "Python",
            "Node.js",
            "IBM Watson AI",
            "NVIDIA",
            "Nebula GraphDB",
            "AI",
            "NLP",
            "entity extraction"
          ],
          "category": "architecture"
        },
        {
          "text": "Modernized legacy development environments into Tilt-orchestrated microservices with integrated observability (Grafana, Prometheus, Jaeger) and comprehensive test suites, leveraging agentic AI tools and custom agents for instrumentation and code generation",
          "keywords": [
            "Tilt",
            "microservices",
            "Grafana",
            "Prometheus",
            "Jaeger",
            "observability",
            "AI agents"
          ],
          "category": "force-multiplier"
        },
        {
          "text": "Established standardized observability practice using OpenTelemetry collectors with Grafana, Prometheus, and Jaeger for distributed tracing; configured Application Insights (Azure) and CloudWatch (AWS) for production debugging",
          "keywords": [
            "OpenTelemetry",
            "Grafana",
            "Prometheus",
            "Jaeger",
            "Application Insights",
            "CloudWatch",
            "distributed tracing"
          ],
          "category": "architecture"
        },
        {
          "text": "Implemented GitHub Action pipelines enforcing pre-merge quality gates including linting, dependency vulnerability scanning, smoke tests, and automated test execution",
          "keywords": [
            "GitHub Actions",
            "CI/CD",
            "quality gates",
            "linting",
            "vulnerability scanning"
          ],
          "category": "force-multiplier"
        },
        {
          "text": "Owned end-to-end deployment pipelines for a .NET scheduling application including automated test gates, staging builds, database backup with diff-based rollback script generation, and coordinated web farm restarts; maintained <5-minute unscheduled downtime SLA for State of New Jersey deployment",
          "metrics": "<5-minute unscheduled downtime SLA",
          "keywords": [
            ".NET",
            "deployment pipeline",
            "database backup",
            "rollback",
            "web farm",
            "SLA"
          ],
          "category": "scale"
        },
        {
          "text": "Championed integration-first testing approach establishing Playwright E2E suites, Vitest/Jest (frontend), xUnit/NUnit (.NET), and pytest (Python); applied JMeter for API load and performance testing",
          "keywords": [
            "Playwright",
            "Vitest",
            "Jest",
            "xUnit",
            "NUnit",
            "pytest",
            "JMeter",
            "E2E testing",
            "load testing"
          ],
          "category": "technical-execution"
        },
        {
          "text": "Architected a secure Azure serverless API (Entra ID OAuth2, API Gateway) interfacing with Databricks and Microsoft Power Platform for AI/ML-driven inventory reconciliation, solving client inability to reconcile inventory between vendors, partners, and internal systems",
          "keywords": [
            "Azure",
            "serverless",
            "Entra ID",
            "OAuth2",
            "API Gateway",
            "Databricks",
            "Power Platform",
            "AI/ML"
          ],
          "category": "architecture"
        },
        {
          "text": "Engineered a custom Node.js and BCP CLI ETL pipeline to migrate 20+ years of active data (millions of records) from unsupported Lotus Notes database to RDBMS with less than 1 hour of production downtime",
          "metrics": "<1 hour downtime for 20+ years of production data migration",
          "keywords": [
            "Node.js",
            "ETL",
            "BCP",
            "data migration",
            "Lotus Notes",
            "RDBMS"
          ],
          "category": "technical-execution"
        },
        {
          "text": "Developed React frontend for a DocuSign-alternative digital signature application integrating Apryse components and Notarius API",
          "keywords": [
            "React",
            "Apryse",
            "digital signatures",
            "Notarius"
          ],
          "category": "technical-execution"
        },
        {
          "text": "Inherited and stabilized a troubled Vue.js ecommerce application for the Golden Gate Bridge as the third developer on the project, resolving build failures, implementing missing test coverage, and delivering to MVP status",
          "keywords": [
            "Vue.js",
            "ecommerce",
            "legacy code",
            "stabilization",
            "MVP",
            "Golden Gate Bridge"
          ],
          "category": "technical-execution"
        },
        {
          "text": "Led IBM Cloud Hackathon team to build 'HavenSync,' a HIPAA-compliant agentic AI disaster relief intake assistant",
          "keywords": [
            "IBM Cloud",